lyrics;details;category
যে আমারে দিয়েছে ডাক,বচনহারা আমাকে দিয়েছে বাক্‌।যে আমারি জেনেছে নাম,ওগো তারি নামখানি মোর হৃদয়ে থাক্‌।আমি তারি বিচ্ছেদদহনেতপ করি চিত্তের গহনে।দুঃখের পাবকে হয়ে যায় শুদ্ধঅন্তরে মলিন যাহা আছে রুদ্ধ,অপমান-নাগিনীর খুলে যায় পাক॥;রাগ: মিশ্র কেদারাতাল: কাহারবারচনাকাল (বঙ্গাব্দ): 1344রচনাকাল (খৃষ্টাব্দ): 1938স্বরলিপিকার: দিনেন্দ্রনাথ ঠাকুর;চণ্ডালিকা (গীতবিতান) (chadalika gitabitan)
কিসের ডাক তোর কিসের ডাক।কোন্‌          পাতালবাসী অপদেবতার ইশারাতোকে ভুলিয়ে নিয়ে যাবে,আমি মন্ত্র প'ড়ে কাটাব তার মায়া।;রাগ: কীর্তনতাল: তেওরারচনাকাল (বঙ্গাব্দ): 1344রচনাকাল (খৃষ্টাব্দ): 1938স্বরলিপিকার: শৈলজারঞ্জন মজুমদার;চণ্ডালিকা (গীতবিতান) (chadalika gitabitan)
"হাঁ গো মা, সেই কথাই তো ব'লে গেলেন তিনি,তিনি আমার আপন জাতের লোক।আমি চণ্ডালী, সে যে মিথ্যা, সে যে মিথ্যা,সে যে দারুণ মিথ্যা।শ্রাবণের কালো যে মেঘতারে যদি নাম দাও ""চণ্ডাল',তা ব'লে কি জাত ঘুচিবে তার,অশুচি হবে কি তার জল।তিনি ব'লে গেলেন আমায়--নিজেরে নিন্দা কোরো না,মানবের বংশ তোমার,মানবের রক্ত তোমার নাড়ীতে।ছি ছি মা, মিথ্যা নিন্দা রটাস নে নিজের,সে-যে পাপ।রাজার বংশে দাসী জন্মায় অসংখ্য,আমি সে দাসী নই।দ্বিজের বংশে চণ্ডাল কত আছে,আমি নই চণ্ডালী।";রাগ: মিশ্র সুরতাল: দাদরারচনাকাল (বঙ্গাব্দ): 1344রচনাকাল (খৃষ্টাব্দ): 1938স্বরলিপিকার: শৈলজারঞ্জন মজুমদার;চণ্ডালিকা (গীতবিতান) (chadalika gitabitan)
কী কথা বলিস তুই,আমি যে তোর ভাষা বুঝি নে।তোর মুখে কে দিল এমন বাণী।স্বপ্নে কি কেউ ভর করেছে তোকেতোর গতজন্মের সাথি।আমি যে তোর ভাষা বুঝি নে।;রাগ: কীর্তনতাল: দাদরারচনাকাল (বঙ্গাব্দ): 1344রচনাকাল (খৃষ্টাব্দ): 1938স্বরলিপিকার: শৈলজারঞ্জন মজুমদার;চণ্ডালিকা (গীতবিতান) (chadalika gitabitan)
এ নতুন জন্ম, নতুন জন্ম,নতুন জন্ম আমার।সেদিন বাজল দুপুরের ঘণ্টা,ঝাঁ ঝাঁ করে রোদ্‌দুর,স্নান করাতেছিলেম কুয়োতলায়মা-মরা বাছুরটিকে।সামনে এসে দাঁড়ালেনবৌদ্ধ ভিক্ষু আমার--বললেন, জল দাও।শিউরে উঠল দেহ আমার,চমকে উঠল প্রাণ।বল্‌ দেখি মা,সারা নগরে কি কোথাও নেই জল!কেন এলেন আমার কুয়োর ধারে,আমাকে দিলেন সহসামানুষের তৃষ্ণা-মেটানো সম্মান।;রাগ: কীর্তনতাল: দাদরারচনাকাল (বঙ্গাব্দ): 1344রচনাকাল (খৃষ্টাব্দ): 1938স্বরলিপিকার: শৈলজারঞ্জন মজুমদার;চণ্ডালিকা (গীতবিতান) (chadalika gitabitan)
বলে,   দাও জল, দাও জল।দেব আমি কে দিয়েছে হেন সম্বল।কালো মেঘ-পানে চেয়েএল ধেয়েচাতক বিহ্বল--বলে,   দাও জল।ভূমিতলে হারাউৎসের ধারাঅন্ধকারেকারাগারে।কার সুগভীর বাণীদিল হানিকালো শিলাতল--বলে    দাও জল॥--;রাগ: বেহাগতাল: দাদরারচনাকাল (বঙ্গাব্দ): 1344রচনাকাল (খৃষ্টাব্দ): 1938স্বরলিপিকার: দিনেন্দ্রনাথ ঠাকুর;চণ্ডালিকা (গীতবিতান) (chadalika gitabitan)
সে যে পথিক আমার,হৃদয়পথের পথিক আমার।হায় রে আর সে তো এল না এল না,এ পথে এল না,আর সে যে চাইল না জল।আমার হৃদয় তাই হল মরুভূমি,শুকিয়ে গেল তার রস--সে যে চাইল না জল।;রাগ: মিশ্র বেহাগ-কীর্তনতাল: ঝাঁপতালরচনাকাল (বঙ্গাব্দ): 1344রচনাকাল (খৃষ্টাব্দ): 1938স্বরলিপিকার: শৈলজারঞ্জন মজুমদার;চণ্ডালিকা (গীতবিতান) (chadalika gitabitan)
চক্ষে আমার তৃষ্ণা,তৃষ্ণা আমার বক্ষ জুড়ে।আমি বৃষ্টিবিহীন বৈশাখী দিন,সন্তাপে প্রাণ যায় যে পুড়ে।ঝড় উঠেছে তপ্ত হাওয়ায় হাওয়ায়,মনকে সুদূর শূন্যে ধাওয়ায়--অবগুণ্ঠন যায় যে উড়ে।যে ফুল কানন করত আলো,কালো হয়ে সে শুকালো।ঝরনারে কে দিল বাধা--নিষ্ঠুর পাষাণে বাঁধাদুঃখের শিখরচূড়ে॥;রাগ: বৃন্দাবনী সারং-আড়ানাতাল: ঝাঁপতালরচনাকাল (বঙ্গাব্দ): 1344রচনাকাল (খৃষ্টাব্দ): 1938স্বরলিপিকার: শৈলজারঞ্জন মজুমদার;চণ্ডালিকা (গীতবিতান) (chadalika gitabitan)
বাছা, সহজ ক'রে বল আমাকেমন কাকে তোর চায়।বেছে নিস মনের মতন বর--রয়েছে তো অনেক আপন জন।আকাশের চাঁদের পানেহাত বাড়াস নে।;রাগ: বেহাগতাল: দাদরারচনাকাল (বঙ্গাব্দ): 1344রচনাকাল (খৃষ্টাব্দ): 1938স্বরলিপিকার: শৈলজারঞ্জন মজুমদার;চণ্ডালিকা (গীতবিতান) (chadalika gitabitan)
আমি চাই তাঁরেআমারে দিলেন যিনি সেবিকার সম্মান,ঝড়ে-পড়া ধুতরো ফুলধুলো হতে তুলে নিলেন যিনি দক্ষিণ করে।ওগো প্রভু, ওগো প্রভুসেই ফুলে মালা গাঁথো,পরো পরো আপন গলায়,ব্যর্থ হতে তারে দিয়ো না দিয়ো না।;রাগ: রামকেলী-ভৈরবীতাল: কাহারবারচনাকাল (বঙ্গাব্দ): 1344রচনাকাল (খৃষ্টাব্দ): 1938স্বরলিপিকার: শৈলজারঞ্জন মজুমদার;চণ্ডালিকা (গীতবিতান) (chadalika gitabitan)
সাত দেশেতে খুঁজে খুঁজে গোশেষকালে এই ঠাঁইভাগ্যে দেখা পেলেম রক্ষা তাই।;রাগ: কীর্তনতাল: দাদরারচনাকাল (বঙ্গাব্দ): 1344রচনাকাল (খৃষ্টাব্দ): 1938স্বরলিপিকার: শৈলজারঞ্জন মজুমদার;চণ্ডালিকা (গীতবিতান) (chadalika gitabitan)
ওগো মা, ওই কথাই তো ভালো।মন্ত্র জানিস তুই,মন্ত্র প'ড়েদে তাঁকে তুই এনে।;রাগ: মিশ্র কেদারাতাল: ঝাঁপতালরচনাকাল (বঙ্গাব্দ): 1344রচনাকাল (খৃষ্টাব্দ): 1938স্বরলিপিকার: শৈলজারঞ্জন মজুমদার;চণ্ডালিকা (গীতবিতান) (chadalika gitabitan)
"না, কিছুই থাকবে না, কিছুই থাকবে না,কিছুই না, কিছুই না।যদি আমার সব মিটে যায়সব মিটে যায়,তবেই আমি বেঁচে যাব যেচিরদিনের তরেযখন কিছুই থাকবে না।দেবার আমার আছে কিছুএই কথাটাই যেভুলিয়ে রেখেছিল সবাই মিলে--আজ জেনেছি, আমি নই-যে অভাগিনী;দেবই আমি, দেবই আমি, দেব,উজাড় করে দেব আমারে।কোনো ভয় আর নেই আমার।পড়্‌ তোর মন্তর, পড়্‌ তোর মন্তর,ভিক্ষুরে নিয়ে আয় অমানিতার পাশে,সে'ই তারে দিবে সম্মান--এত মান আর কেউ দিতে কি পারে।";রাগ: কেদারাতাল: দাদরারচনাকাল (বঙ্গাব্দ): 1344রচনাকাল (খৃষ্টাব্দ): 1938স্বরলিপিকার: শৈলজারঞ্জন মজুমদার;চণ্ডালিকা (গীতবিতান) (chadalika gitabitan)
বাছা, তুই যে আমার বুকচেরা ধন।তোর কথাতেই চলেছিপাপের পথে, পাপীয়সী।হে পবিত্র মহাপুরুষ,আমার অপরাধের শক্তি যতক্ষমার শক্তি তোমারআরো অনেক গুণে বড়ো।তোমারে করিব অসম্মান--তবু প্রণাম, তবু প্রণাম, তবু প্রণাম।;রাগ: নট-কেদারাতাল: কাহারবারচনাকাল (বঙ্গাব্দ): 1344রচনাকাল (খৃষ্টাব্দ): 1938স্বরলিপিকার: শৈলজারঞ্জন মজুমদার;চণ্ডালিকা (গীতবিতান) (chadalika gitabitan)
আমায়     দোষী করো।ধুলায়-পড়া ম্লান কুসুমপায়ের তলায় ধরো।অপরাধে ভরা ডালিনিজ হাতে করো খালি,তার পরে সেই শূন্য ডালায়তোমার করুণা ভরো--আমায় দোষী করো।তুমি উচ্চ, আমি তুচ্ছধরব তোমায় ফাঁদেআমার অপরাধে।আমার দোষকে তোমার পুণ্যকরবে তো কলঙ্কশূন্য--ক্ষমায় গেঁথে সকল ত্রুটিগলায় তোমার পরো॥;রাগ: ভৈরবীতাল: দাদরারচনাকাল (বঙ্গাব্দ): 1340রচনাকাল (খৃষ্টাব্দ): 1933স্বরলিপিকার: দিনেন্দ্রনাথ ঠাকুর;চণ্ডালিকা (গীতবিতান) (chadalika gitabitan)
"কী অসীম সাহস তোর, মেয়ে।আমার সাহস!তাঁর সাহসের নাই তুলনা।কেউ যে কথা বলতে পারে নিতিনি ব'লে দিলেন কত সহজে--জল দাও।ওই একটু বাণী--তার দীপ্তি কত;আলো ক'রে দিল আমার সারা জন্ম।বুকের উপর কালো পাথর চাপা ছিল যে,সেটাকে ঠেলে দিল--উথলি উঠল রসের ধারা।";রাগ: কীর্তনতাল: দাদরারচনাকাল (বঙ্গাব্দ): 1344রচনাকাল (খৃষ্টাব্দ): 1938স্বরলিপিকার: শৈলজারঞ্জন মজুমদার;চণ্ডালিকা (গীতবিতান) (chadalika gitabitan)
ওরা কে যায়পীতবসন-পরা সন্ন্যাসী।;রচনাকাল (বঙ্গাব্দ): 1344রচনাকাল (খৃষ্টাব্দ): 1938স্বরলিপিকার: শৈলজারঞ্জন মজুমদার;চণ্ডালিকা (গীতবিতান) (chadalika gitabitan)
মা, ওই যে তিনি চলেছেনসবার আগে আগে!ফিরে তাকালেন না, ফিরে তাকালেন না--তাঁর নিজের হাতের এই নূতন সৃষ্টিরেআর দেখিলেন না চেয়ে!এই মাটি, এই মাটি, এই মাটিই তোরআপন রে!হতভাগিনী, কে তোরে আনিল আলোতেশুধু এক নিমেষের জন্যে!থাকতে হবে তোকে মাটিতেইসবার পায়ের তলায়।;রাগ: হাম্বীর-কেদারাতাল: কাহারবারচনাকাল (বঙ্গাব্দ): 1344রচনাকাল (খৃষ্টাব্দ): 1938স্বরলিপিকার: শৈলজারঞ্জন মজুমদার;চণ্ডালিকা (গীতবিতান) (chadalika gitabitan)
ওরে বাছা, দেখতে পারি নে তোর দুঃখ--আনবই আনবই, আনবই তারেমন্ত্র প'ড়ে।;রাগ: মিশ্র কেদারাতাল: ঝাঁপতালরচনাকাল (বঙ্গাব্দ): 1344রচনাকাল (খৃষ্টাব্দ): 1938স্বরলিপিকার: শৈলজারঞ্জন মজুমদার;চণ্ডালিকা (গীতবিতান) (chadalika gitabitan)
পড়্‌ তুই সব চেয়ে নিষ্ঠুর মন্ত্র,পাকে পাকে দাগ দিয়েজড়ায়ে ধরুক ওর মনকে।যেখানেই যাক,কখনো এড়াতে আমাকেপারবে না, পারবে না।;রাগ: মিশ্র কেদারাতাল: কাহারবারচনাকাল (বঙ্গাব্দ): 1344রচনাকাল (খৃষ্টাব্দ): 1938স্বরলিপিকার: শৈলজারঞ্জন মজুমদার;চণ্ডালিকা (গীতবিতান) (chadalika gitabitan)
যায় যদি যাক সাগরতীরে--আবার আসুক, আসুক ফিরে।রেখে দেব আসন পেতেহৃদয়েতে।পথের ধুলো ভিজিয়ে দেবঅশ্রুনীরে।যায় যদি যাক শৈলশিরে--আসুক ফিরে, আসুক ফিরে।লুকিয়ে রব গিরিগুহায়,ডাকব উহায়--আমার স্বপন ওর জাগরণরইবে ঘিরে॥;রাগ: কাফিতাল: কাহারবারচনাকাল (বঙ্গাব্দ): 1344রচনাকাল (খৃষ্টাব্দ): 1938স্বরলিপিকার: দিনেন্দ্রনাথ ঠাকুর;চণ্ডালিকা (গীতবিতান) (chadalika gitabitan)
ভাবনা করিস নে তুই--এই দেখ্‌ মায়াদর্পণ আমার,হাতে নিয়ে নাচবি যখনদেখতে পাবি তাঁর কী হল দশা।এইবার এসো এসো রুদ্রভৈরবের সন্তান,জাগাও তাণ্ডবনৃত্য।;রাগ: খাম্বাজ-কেদারাতাল: কাহারবারচনাকাল (বঙ্গাব্দ): 1344রচনাকাল (খৃষ্টাব্দ): 1938স্বরলিপিকার: শৈলজারঞ্জন মজুমদার;চণ্ডালিকা (গীতবিতান) (chadalika gitabitan)
ওই দেখ্‌ পশ্চিমে মেঘ ঘনালো,মন্ত্র খাটবে মা, খাটবে--উড়ে যাবে শুষ্ক সাধনা সন্ন্যাসীরশুকনো পাতার মতন।নিববে বাতি, পথ হবে অন্ধকার,ঝড়ে-বাসা-ভাঙা পাখিঘুরে ঘুরে পড়বে এসে মোর দ্বারে।দুরু দুরু করে মোর বক্ষ,মনের মাঝে ঝিলিক দিতেছে বিজুলি।দূরে যেন ফেনিয়ে উঠেছে সমুদ্র--তল নেই, কূল নেই তার।মন্ত্র খাটবে মা, খাটবে।;রাগ: গৌড়মল্লার-কেদারাতাল: কাহারবারচনাকাল (বঙ্গাব্দ): 1344রচনাকাল (খৃষ্টাব্দ): 1938স্বরলিপিকার: শৈলজারঞ্জন মজুমদার;চণ্ডালিকা (গীতবিতান) (chadalika gitabitan)
লজ্জা ছি ছি লজ্জা!আকাশে তুলে দুই বাহুঅভিশাপ দিচ্ছেন কাকে।নিজেরে মারছেন বহ্নির বেত্র,শেল বিঁধছেন যেন আপনার মর্মে।;রাগ: সোহিনীতাল: কাহারবারচনাকাল (বঙ্গাব্দ): 1344রচনাকাল (খৃষ্টাব্দ): 1938স্বরলিপিকার: শৈলজারঞ্জন মজুমদার;চণ্ডালিকা (গীতবিতান) (chadalika gitabitan)
ওরে বাছা, এখনি অধীর হলি যদি,শেষে তোর কী হবে দশা।;রাগ: ভৈরবতাল: কাহারবারচনাকাল (বঙ্গাব্দ): 1344রচনাকাল (খৃষ্টাব্দ): 1938স্বরলিপিকার: শৈলজারঞ্জন মজুমদার;চণ্ডালিকা (গীতবিতান) (chadalika gitabitan)
আমি দেখব না, আমি দেখব না,আমি দেখব না তোর দর্পণ।বুক ফেটে যায়, যায় গো,বুক ফেটে যায়।কী ভয়ংকর দুঃখের ঘূর্ণিঝঞ্ঝা--মহান বনস্পতি ধুলায় কি লুটাবে,ভাঙবে কি অভ্রভেদী তার গৌরব।দেখব না, আমি দেখব না তোর দর্পণ।না না না।;রাগ: সোহিনীতাল: কাহারবারচনাকাল (বঙ্গাব্দ): 1344রচনাকাল (খৃষ্টাব্দ): 1938স্বরলিপিকার: শৈলজারঞ্জন মজুমদার;চণ্ডালিকা (গীতবিতান) (chadalika gitabitan)
সেই ভালো মা, সেই ভালো।থাক্‌ তোর মন্ত্র, থাক্‌ তোর--আর কাজ নাই, কাজ নাই ,কাজ নাই।না না না, পড়্‌ মন্ত্র তুই, পড়্‌ তোর মন্ত্র--পথ তো আর নেই বাকি!আসবে সে, আসবে সে, আসবে,আমার জীবনমৃত্যু-সীমানায় আসবে।নিবিড় রাত্রে এসে পৌঁছবে পান্থ,বুকের জ্বালা দিয়ে আমিজ্বালিয়ে দিব দীপখানি--সে আসবে।;রাগ: ইমন-ভূপালী-কীর্তনতাল: কাহারবারচনাকাল (বঙ্গাব্দ): 1344রচনাকাল (খৃষ্টাব্দ): 1938স্বরলিপিকার: শৈলজারঞ্জন মজুমদার;চণ্ডালিকা (গীতবিতান) (chadalika gitabitan)
দুঃখ দিয়ে মেটাব দুঃখ তোমার।স্নান করাব অতল জলেবিপুল বেদনার।মোর সংসার দিব যে জ্বালি,শোধন হবে এ মোহের কালি--মরণব্যথা দিব তোমারচরণে উপহার॥;রাগ: বাগেশ্রীতাল: কাহারবারচনাকাল (বঙ্গাব্দ): 1340রচনাকাল (খৃষ্টাব্দ): 1933স্বরলিপিকার: দিনেন্দ্রনাথ ঠাকুর;চণ্ডালিকা (গীতবিতান) (chadalika gitabitan)
মা গো, এতদিনে মনে হচ্ছে যেনটলেছে আসন তাঁহার।ওই আসছে, আসছে, আসছে।যা বহু দূরে, যা লক্ষ যোজন দূরে,যা চন্দ্রসূর্য পেরিয়ে,ওই আসছে, আসছে, আসছে--কাঁপছে আমার বক্ষ ভূমিকম্পে।;রাগ: কীর্তনতাল: দাদরারচনাকাল (বঙ্গাব্দ): 1344রচনাকাল (খৃষ্টাব্দ): 1938স্বরলিপিকার: শৈলজারঞ্জন মজুমদার;চণ্ডালিকা (গীতবিতান) (chadalika gitabitan)
ঘন কালো মেঘ তাঁর পিছনে,চারি দিকে বিদ্যুৎ চমকে।অঙ্গ ঘিরে ঘিরে তাঁরঅগ্নির আবেষ্টন,যেন শিবের ক্রোধানলদীপ্তি।তোর মন্ত্রবাণী ধরি কালীনাগিনীমূর্তিগর্জিছে বিষনিশ্বাসে,কলুষিত করে তাঁর পুণ্যশিখা।;রাগ: সাহানাতাল: কাহারবারচনাকাল (বঙ্গাব্দ): 1344রচনাকাল (খৃষ্টাব্দ): 1938স্বরলিপিকার: শৈলজারঞ্জন মজুমদার;চণ্ডালিকা (গীতবিতান) (chadalika gitabitan)
